{
  "version": "0.1",
  "message_type": "event",
  "routing": {
    "id": "evt-transcribed-1",
    "channel": "devices",
    "direction": "outbound",
    "sender_id": "server",
    "recipient_id": "device-1",
    "timestamp": "2026-04-28T18:00:03Z",
    "metadata": {}
  },
  "content": [],
  "event": {
    "type": "message.transcribed",
    "ref_id": "msg-audio-1",
    "data": {
      "transcript": "Hello Hiro"
    }
  }
}
