{
  "version": "0.1",
  "message_type": "message",
  "routing": {
    "id": "msg-audio-1",
    "channel": "devices",
    "direction": "outbound",
    "sender_id": "device-1",
    "timestamp": "2026-04-28T18:00:01Z",
    "metadata": {
      "chat_channel_id": "1"
    }
  },
  "content": [
    {
      "content_type": "audio",
      "body": "UklGRg==",
      "metadata": {
        "duration_ms": 1200,
        "mime_type": "audio/m4a"
      }
    }
  ]
}
