{
  "version": "0.1",
  "message_type": "message",
  "routing": {
    "id": "msg-text-1",
    "channel": "devices",
    "direction": "outbound",
    "sender_id": "device-1",
    "timestamp": "2026-04-28T18:00:00Z",
    "metadata": {
      "chat_channel_id": "1"
    }
  },
  "content": [
    {
      "content_type": "text",
      "body": "Hello Hiro",
      "metadata": {}
    }
  ]
}
