{
  "version": "0.1",
  "message_type": "response",
  "request_id": "req-1",
  "routing": {
    "id": "resp-1",
    "channel": "devices",
    "direction": "outbound",
    "sender_id": "server",
    "recipient_id": "device-1",
    "timestamp": "2026-04-28T18:00:06Z",
    "metadata": {}
  },
  "content": [
    {
      "content_type": "json",
      "body": "{\"status\":\"ok\",\"data\":{\"channels\":[]}}",
      "metadata": {}
    }
  ]
}
